{"id":"LIN-0159","from":{"artifact_id":"ART-0213","name":"GNU Zebra internal Zebra protocol","revision":"Version 0"},"to":{"artifact_id":"ART-0213","name":"Quagga internal Zebra protocol","revision":"Versions 0-3"},"relation":"carried-over","scope":["software-api","architecture"],"property":"internal daemon-to-zebra route/control protocol retained and revised across the GNU Zebra→Quagga fork lineage","date_or_range":{"value":"GNU Zebra → Quagga","precision":"range","notes":null},"certainty":"confirmed","directness":"documented-operational","sources":[{"source_ref":"SRC-0221","locator":"Zebra protocol Version History","supports":"FRR documentation records Version 0 use by GNU Zebra and early Quagga and subsequent Quagga protocol versions.","notes":null}],"negative_claims":["This edge describes internal protocol continuity, not every source file or daemon implementation."],"open_questions":["Archive exact header definitions for v0-v3 and map them to releases."],"notes":null,"last_reviewed":"2026-08-29"}