{"id":"LIN-0130","from":{"artifact_id":"ART-0179","name":"original private-use ASN reservation","revision":"64512-65534 private-use range","historical_term":"private AS numbers"},"to":{"artifact_id":"ART-0179","name":"expanded private-use ASN reservations","revision":"RFC 6996","historical_term":"Private Use ASNs"},"relation":"carried-over","scope":["routing","management"],"property":"existing private-use semantics are retained while an additional four-octet private-use range is added for larger deployment domains.","date_or_range":{"value":"1996-2013","precision":"range","notes":null},"certainty":"confirmed","directness":"formal","sources":[{"source_ref":"SRC-0175","locator":"RFC 6996 Sections 1-3","supports":"retention of old private range plus new four-octet private range","notes":null}],"negative_claims":["The new private ASN range does not replace or renumber the old private range.","Private-use ASNs are not globally registered identities."],"open_questions":[],"notes":null,"last_reviewed":"2026-08-29"}