{"id":"LIN-0139","from":{"artifact_id":"ART-0192","name":"BSD Packet Filter architecture","revision":"1993 packet-capture BPF","historical_term":"BPF"},"to":{"artifact_id":"ART-0193","name":"libpcap capture/filter interface","revision":"portable libpcap lineage","historical_term":"libpcap"},"relation":"derived-from","scope":["operations","software-api","architecture"],"property":"libpcap exposes portable capture/filter semantics and uses filtering based on the BSD Packet Filter architecture while adapting to multiple OS capture mechanisms.","date_or_range":{"value":"1990s-present","precision":"range","notes":null},"certainty":"confirmed","directness":"documented-design","sources":[{"source_ref":"SRC-0192","locator":"USENIX BPF paper","supports":"BPF architecture","notes":null},{"source_ref":"SRC-0193","locator":"libpcap README","supports":"portable capture role and BPF-based filtering statement","notes":null}],"negative_claims":["libpcap is not identical to a kernel BPF implementation.","The 1993 BPF packet-capture architecture should not be collapsed into all later eBPF systems."],"open_questions":["Recover first libpcap release and exact transition from earlier tcpdump capture code."],"notes":null,"last_reviewed":"2026-08-29"}