{"id":"LIN-0186","from":{"artifact_id":"ART-0232","name":"VRF with per-device iif/oif policy rules"},"to":{"artifact_id":"ART-0233","name":"generic l3mdev FIB rule"},"relation":"successor-of","scope":["routing","software-api","operations"],"property":"one generic l3mdev policy rule replaces repeated per-VRF input/output-interface rules for normal VRF table selection","date_or_range":{"value":"2016","precision":"year","notes":"Linux 4.8 transition"},"certainty":"confirmed","directness":"formal","sources":[{"source_ref":"SRC-0247","locator":"VRF documentation: Setup step 2","supports":"explicit pre-4.8 versus 4.8 rule configuration"}],"negative_claims":["The l3mdev rule does not eliminate RPDB policy routing or prevent higher-priority custom rules."],"open_questions":["Recover exact merge commit and review discussion."],"notes":null,"last_reviewed":"2026-08-29"}