{"id":"LIN-0161","from":{"artifact_id":"ART-0214","name":"ifconfig / ioctl interface-control model"},"to":{"artifact_id":"ART-0215","name":"rtnetlink link/address control model"},"relation":"role-descends-into","scope":["software-api","operations","architecture"],"property":"Linux interface/address administration moved from ioctl-oriented operations toward extensible rtnetlink object messages.","certainty":"confirmed","directness":"documented-operational","sources":[{"source_ref":"SRC-0222","locator":"ifconfig BUGS","supports":"documents ioctl access limitations and directs users to ip link","notes":null},{"source_ref":"SRC-0225","locator":"rtnetlink link/address message definitions","supports":"documents the newer object/message control family","notes":null}],"negative_claims":["rtnetlink is not a formal version of the ifconfig command or a wire-protocol revision of ioctl."],"open_questions":[],"notes":null,"last_reviewed":"2026-08-29"}