{"id":"LIN-0173","from":{"artifact_id":"ART-0213","name":"ZAPI version 0","revision":"v0"},"to":{"artifact_id":"ART-0213","name":"ZAPI version 1","revision":"v1"},"relation":"revision-of","scope":["software-api","architecture"],"property":"v1 adds marker and version fields and expands command to 16 bits.","certainty":"confirmed","directness":"formal","sources":[{"source_ref":"SRC-0235","locator":"Version History / v0-v1 header diagrams","supports":"explicit revision differences","notes":null}],"negative_claims":[],"open_questions":[],"notes":null,"last_reviewed":"2026-08-29"}