{"id":"LIN-0134","from":{"artifact_id":"ART-0178","name":"Assigned Numbers publication/registry system","revision":"RFC snapshot and IANA registry lineage","historical_term":"Assigned Numbers"},"to":{"name":"Unix local service/protocol name databases","revision":"4.2BSD-era /etc/services and /etc/protocols","historical_term":"service/protocol name data base"},"relation":"carried-over","scope":["management","software-api","operations"],"property":"globally coordinated service-port and protocol-number identities are projected into local Unix text databases so programs can resolve human names to wire numbers.","date_or_range":{"value":"1983-present","precision":"range","notes":null},"certainty":"confirmed","directness":"documented-operational","sources":[{"source_ref":"SRC-0185","locator":"services(5) DESCRIPTION/HISTORY","supports":"local service name/port database and 4.2BSD origin","notes":null},{"source_ref":"SRC-0186","locator":"protocols(5) DESCRIPTION/HISTORY","supports":"local protocol name/number database and 4.2BSD origin","notes":null}],"negative_claims":["/etc/services and /etc/protocols are not authoritative Internet registries.","Local administrators or vendors may add, omit or lag entries."],"open_questions":["Diff 4.2BSD files against contemporary Assigned Numbers snapshots."],"notes":null,"last_reviewed":"2026-08-29"}