{"id":"LIN-0172","from":{"artifact_id":"ART-0223","name":"Linux RPDB"},"to":{"artifact_id":"ART-0224","name":"ip rule / multiple-FIB administration"},"relation":"interface-convention-inherited-by","scope":["routing","operations","software-api"],"property":"ip rule presents RPDB selectors/actions and selects routing-table lookups.","certainty":"confirmed","directness":"documented-operational","sources":[{"source_ref":"SRC-0234","locator":"command syntax and description","supports":"ip rule manages the routing policy database","notes":null}],"negative_claims":[],"open_questions":[],"notes":null,"last_reviewed":"2026-08-29"}