{"id":"LIN-0165","from":{"name":"TCP retransmission-timer and RTT estimator concepts","historical_term":"RTO/RTT/RTTVAR"},"to":{"artifact_id":"ART-0219","name":"ss TCP diagnostic output"},"relation":"carried-over","scope":["transport","operations"],"property":"standardized TCP timing concepts survive as endpoint implementation state exposed by diagnostics.","certainty":"confirmed","directness":"documented-design","sources":[{"source_ref":"SRC-0230","locator":"RFC 6298","supports":"RTO/RTT estimator semantics","notes":null},{"source_ref":"SRC-0227","locator":"ss -i fields","supports":"rto and rtt/rttvar display","notes":null}],"negative_claims":["RTO and RTT are not literal TCP header fields carried on every packet."],"open_questions":[],"notes":null,"last_reviewed":"2026-08-29"}