{"id":"LIN-0160","from":{"artifact_id":"ART-0213","name":"Quagga internal Zebra protocol","revision":"Version 3"},"to":{"artifact_id":"ART-0213","name":"FRRouting internal Zebra protocol","revision":"Version 4"},"relation":"revision-of","scope":["software-api","architecture"],"property":"post-fork internal protocol revision, including marker change deliberately preventing accidental Quagga/FRR daemon binary mixing","date_or_range":{"value":"FRR fork era","precision":"range","notes":null},"certainty":"confirmed","directness":"documented-design","sources":[{"source_ref":"SRC-0221","locator":"Zebra protocol Version History","supports":"FRR documentation records v3 through the fork and v4 marker change in early FRR.","notes":null}],"negative_claims":["This does not imply general wire compatibility between all Quagga and FRR releases."],"open_questions":["Pin source commit introducing v4 and identify exact Quagga v3 wire fields."],"notes":"A rare internal-protocol revision that intentionally encodes a fork compatibility boundary.","last_reviewed":"2026-08-29"}