{"id":"LIN-0146","from":{"name":"BSD/POSIX host and service lookup interface tradition","historical_term":"gethostbyname/getservbyname and protocol-independent interface work"},"to":{"artifact_id":"ART-0201","name":"getaddrinfo()/getnameinfo protocol-independent socket lookup interface"},"relation":"derived-from","scope":["software-api","application","architecture"],"property":"combine node-name and service-name translation with address-family/socket/protocol selection into ready-to-use socket-address candidates","date_or_range":{"value":"1990s-2003","precision":"range","notes":null},"certainty":"confirmed","directness":"documented-design","sources":[{"source_ref":"SRC-0203","locator":"RFC 2553 Section 6.4 and Acknowledgments","supports":"RFC documents POSIX protocol-independent origin, earlier design work and prototype history.","notes":null},{"source_ref":"SRC-0204","locator":"RFC 3493 Sections 6.1-6.2","supports":"Later consolidated specification of getaddrinfo/getnameinfo.","notes":null}],"negative_claims":["getaddrinfo is not a DNS-only API.","The call does not prove which NSS/resolver backend supplied a result."],"open_questions":["Locate earliest prototype source and deployment release."],"notes":null,"last_reviewed":"2026-08-29"}