{"id":"LIN-0151","from":{"artifact_id":"ART-0203","name":"BSD routed single/dominant RIP-family daemon role"},"to":{"artifact_id":"ART-0207","name":"GateD multiprotocol routing daemon role"},"relation":"successor-of","scope":["routing","operations","architecture"],"property":"replacement/role expansion from routed-centric interior routing to one configurable daemon speaking RIP, EGP and HELLO across routing domains","date_or_range":{"value":"late 1980s","precision":"decade","notes":null},"certainty":"confirmed","directness":"documented-operational","sources":[{"source_ref":"SRC-0209","locator":"RFC 1118 Gated subsection","supports":"Contemporary text calls GateD a replacement for routed and describes RIP/EGP/HELLO interoperation.","notes":null}],"negative_claims":["This does not claim all routed code was inherited by GateD.","It does not make GateD the ancestor of every later multiprotocol routing suite."],"open_questions":["Acquire first GateD source and compare its kernel/RIP code with routed."],"notes":"Strong role-successor evidence with code ancestry still open.","last_reviewed":"2026-08-29"}