{"id":"LIN-0181","from":{"artifact_id":"ART-0226","name":"nlmsghdr/message batching in old Netlink generation"},"to":{"artifact_id":"ART-0227","name":"rtnetlink message framework"},"relation":"carried-over","scope":["software-api","interface"],"property":"generic Netlink message-header concepts survive across the transport/object-model transition","date_or_range":{"value":"1996-1997","precision":"range","notes":null},"certainty":"confirmed","directness":"documented-design","sources":[{"source_ref":"SRC-0237","locator":"nlmsg_* code in 2.1.15 netlink.c","supports":"message header/batching before modern rtnetlink"},{"source_ref":"SRC-0238","locator":"rtnetlink.h includes linux/netlink.h and uses nlmsghdr/attributes","supports":"later framework builds on Netlink message grammar"}],"negative_claims":["Transport/API continuity must not be inferred from message-header continuity; the character-device and socket-family stages are distinct."],"open_questions":[],"notes":"A good example of one layer surviving while another layer is replaced.","last_reviewed":"2026-08-29"}