{
  "id":"LIN-0114","from":{"artifact_id":"ART-0162","name":"DNS Resource Record typed extension framework","revision":"RFC 1034/1035 core","historical_term":"Resource Record"},"to":{"artifact_id":null,"name":"AAAA Resource Record","revision":"RFC 3596 / 2003","historical_term":"AAAA"},"relation":"carried-over","scope":["application","addressing","architecture"],"property":"The existing DNS typed-record container is reused to add a 128-bit IPv6 address RR while retaining the DNS database/wire architecture.","date_or_range":{"value":"1987-11/2003-10","precision":"range","notes":null},"certainty":"confirmed","directness":"formal","sources":[{"source_ref":"SRC-0143","locator":"RFC 1035 Section 3.2","supports":"generic RR structure and TYPE-based RDATA interpretation","notes":null},{"source_ref":"SRC-0151","locator":"RFC 3596 Sections 1-2","supports":"AAAA RR added in a way designed for compatibility with existing DNS applications/implementations","notes":null}],"negative_claims":["AAAA is not a revision of A; the two address-record types coexist for different IP versions.","This edge does not imply IPv6 is derived from IPv4 DNS semantics."],"open_questions":["Promote AAAA as its own artifact if implementation-level archaeology deepens."],"notes":"Classic extension-container lineage.","last_reviewed":"2026-08-29"
}